{
	"language": "react-typescript",
	"structure": {
		"customTypes": "customType",
		"atoms": "atom",
		"languages": {
			"type": "language",
			"language": "javascript",
			"generateIndex": true
		},
		"utils": {
			"type": "util",
			"prefix": "U",
			"caseFormat": "kebab-upper",
			"generateIndex": true
		},
		"constants": {
			"type": "constant",
			"prefix": "C",
			"caseFormat": {
				"name": "snake-upper",
				"file": "snake",
				"folder": "kebab"
			},
			"generateSubdirs": true
		},
		"extensions": {
			"type": "extension",
			"prefix": "E",
			"caseFormat": {
				"name": "camel-upper",
				"file": "camel",
				"folder": "kebab"
			},
			"generateSubdirs": true
		},
		"service": {
			"type": "service",
			"suffix": "Service",
			"caseFormat": {
				"name": "snake-upper",
				"file": "snake",
				"folder": "kebab"
			},
			"generateSubdirs": true
		},
		"components": {
			"type": "indexCheck",
			"subdirs": {
				"views": {
					"type": "view",
					"generateIndex": true,
					"generateSubdirs": true,
					"generateSubIndex": false,
					"prefix": "I",
					"caseFormat": {
						"name": "camel-upper",
						"file": "camel",
						"folder": "kebab"
					}
				},
				"notAnObject": "notAnObject",
				"none": {
					"type": "none",
					"generateIndex": false,
					"generateSubdirs": false,
					"generateSubIndex": false
				},
				"genFolder": {
					"type": "genFolder",
					"generateIndex": false,
					"generateSubdirs": false,
					"generateSubIndex": false
				},
				"genIndexOnly": {
					"type": "genIndexOnly",
					"generateIndex": true,
					"generateSubdirs": false,
					"generateSubIndex": false,
					"prefix": "I",
					"caseFormat": {
						"name": "camel-upper",
						"file": "camel",
						"folder": "kebab"
					}
				},
				"folderAndIndex": {
					"type": "folderAndIndex",
					"generateIndex": true,
					"generateSubdirs": false,
					"generateSubIndex": false,
					"prefix": "I",
					"caseFormat": {
						"name": "camel-upper",
						"file": "camel",
						"folder": "kebab"
					}
				},
				"subDir": {
					"type": "subDir",
					"generateIndex": false,
					"generateSubdirs": true,
					"generateSubIndex": false,
					"prefix": "I",
					"caseFormat": {
						"name": "camel-upper",
						"file": "pascal",
						"folder": "kebab"
					}
				},
				"subIndexOnly": {
					"type": "subIndexOnly",
					"generateIndex": false,
					"generateSubdirs": false,
					"generateSubIndex": true,
					"prefix": "I",
					"caseFormat": {
						"name": "camel-upper",
						"file": "camel",
						"folder": "kebab"
					}
				},
				"subDirAndSubIndex": {
					"type": "subDirAndSubIndex",
					"generateIndex": false,
					"generateSubdirs": true,
					"generateSubIndex": true,
					"prefix": "I",
					"caseFormat": {
						"name": "camel-upper",
						"file": "camel",
						"folder": "kebab"
					}
				},
				"folderAndSubDir": {
					"type": "folderAndSubDir",
					"generateIndex": false,
					"generateSubdirs": true,
					"generateSubIndex": false,
					"prefix": "I",
					"caseFormat": {
						"name": "camel-upper",
						"file": "camel",
						"folder": "kebab"
					}
				},
				"folderAndSubIndex": {
					"type": "folderAndSubIndex",
					"generateIndex": false,
					"generateSubdirs": false,
					"generateSubIndex": true,
					"prefix": "I",
					"caseFormat": {
						"name": "camel-upper",
						"file": "camel",
						"folder": "kebab"
					}
				},
				"folderAndSubDirAndSubIndex": {
					"type": "folderAndSubDirAndSubIndex",
					"generateIndex": false,
					"generateSubdirs": true,
					"generateSubIndex": true,
					"prefix": "I",
					"caseFormat": {
						"name": "camel-upper",
						"file": "camel",
						"folder": "kebab"
					}
				},
				"indexAndSubDir": {
					"type": "indexAndSubDir",
					"generateIndex": true,
					"generateSubdirs": true,
					"generateSubIndex": false,
					"prefix": "I",
					"caseFormat": {
						"name": "camel-upper",
						"file": "camel",
						"folder": "kebab"
					}
				},
				"indexAndSubIndex": {
					"type": "indexAndSubIndex",
					"generateIndex": true,
					"generateSubdirs": false,
					"generateSubIndex": true,
					"prefix": "I",
					"caseFormat": {
						"name": "camel-upper",
						"file": "camel",
						"folder": "kebab"
					}
				},
				"indexAndSubDirAndSubIndex": {
					"type": "indexAndSubDirAndSubIndex",
					"generateIndex": true,
					"generateSubdirs": true,
					"generateSubIndex": true,
					"prefix": "I",
					"caseFormat": {
						"name": "camel-upper",
						"file": "camel",
						"folder": "kebab"
					}
				},
				"folderAndIndexAndSubDir": {
					"type": "folderAndIndexAndSubDir",
					"generateIndex": true,
					"generateSubdirs": true,
					"generateSubIndex": false,
					"prefix": "I",
					"caseFormat": {
						"name": "camel-upper",
						"file": "camel",
						"folder": "kebab"
					}
				},
				"folderAndIndexAndSubIndex": {
					"type": "folderAndIndexAndSubIndex",
					"generateIndex": true,
					"generateSubdirs": false,
					"generateSubIndex": true,
					"prefix": "I",
					"caseFormat": {
						"name": "camel-upper",
						"file": "camel",
						"folder": "kebab"
					}
				},
				"folderAndIndexAndSubDirAndSubIndex": {
					"type": "folderAndIndexAndSubDirAndSubIndex",
					"generateIndex": true,
					"generateSubdirs": true,
					"generateSubIndex": true,
					"prefix": "I",
					"caseFormat": {
						"name": "camel-upper",
						"file": "camel",
						"folder": "kebab"
					}
				},
				"nested": {
					"type": "nested",
					"generateIndex": true,
					"generateSubdirs": true,
					"generateSubIndex": true,
					"prefix": "I",
					"caseFormat": {
						"name": "camel-upper",
						"file": "camel",
						"folder": "kebab"
					},
					"subdirs": {
						"nested2": {
							"type": "nested2",
							"generateIndex": true,
							"generateSubdirs": true,
							"generateSubIndex": true,
							"prefix": "I",
							"caseFormat": {
								"name": "camel-upper",
								"file": "camel",
								"folder": "kebab"
							},
							"subdirs": {
								"nested3": {
									"type": "nested3",
									"generateIndex": false,
									"generateSubdirs": false,
									"generateSubIndex": false,
									"prefix": "I",
									"caseFormat": {
										"name": "camel-upper",
										"file": "camel",
										"folder": "kebab"
									},
									"subdirs": {
										"ultraNested": {
											"type": "ultraNested",
											"generateIndex": false,
											"generateSubdirs": false,
											"generateSubIndex": false,
											"prefix": "I",
											"caseFormat": {
												"name": "camel-upper",
												"file": "camel",
												"folder": "kebab"
											}
										},
										"ultraNestedWithIndex": {
											"type": "ultraNestedWithIndex",
											"generateIndex": true,
											"generateSubdirs": true,
											"generateSubIndex": true,
											"prefix": "I",
											"caseFormat": {
												"name": "camel-upper",
												"file": "camel",
												"folder": "kebab"
											}
										}
									}
								}
							}
						}
					}
				},
				"screens": "screen",
				"conflicts": "conflic",
				"conflicts2": "conflic"
			}
		}
	},
	"defaultStructureItem": {
		"generateIndex": false
	},
	"plugins": ["@amphore-dev/architect-plugin-react"]
}
