{
	"structure": {
		"customTypes": "customType",
		"atoms": "atom",
		"utils": "util",
		"components": {
			"type": "component",
			"subdirs": {
				"molecules": "molecule",
				"organisms": "organism",
				"templates": "template",
				"pages": "page"
			}
		}
	},
	"blueprints": ["src/tests/src/blueprints"],
	"language": "react-typescript",
	"plugins": ["@amphore-dev/architect-plugin-react"]
}
